{"schema_version":"2.0.0","capability_id":"O001","skill_name":"cs-conductor-runtime","display_name":"CONDUCTOR deterministic runtime","version":"0.1.9","stage":"orchestration","family":"workflow_runtime","description":"固定された基本計算、定型解析、Report、Interpretation、Auditを管理する単純なRuntime。","cost":{"class":"low","human_approval_required":false,"hpc_profile":"cpu64"},"applicability":{"status":"stable","platforms":["linux-64","win-64"]},"dependencies":[],"input_contract":["analysis_profile","endpoint_csv","human_round_authorization"],"output":{"control":"conductor_control.json","dag":"runtime/dag.json","events":"runtime/events.jsonl","audit":"state/<timestamp>/"},"implementation":{"node_states":["pending","running","succeeded","failed","cancelled"],"human_round_authority":true,"automatic_next_round":false}}
