{
  "schema_version": "2.0.0",
  "capability_id": "O002",
  "skill_name": "cs-conductor-state-report",
  "display_name": "CONDUCTOR State DAG report",
  "version": "0.1.6",
  "stage": "orchestration",
  "family": "state_reporting",
  "description": "Use only on an explicit human request with an explicitly supplied Run Root to render a read-only timestamped HTML and SVG execution DAG report.",
  "cost": {
    "class": "low",
    "human_approval_required": false,
    "hpc_profile": "cpu64"
  },
  "applicability": {
    "status": "stable",
    "platforms": [
      "linux-64",
      "win-64"
    ]
  },
  "dependencies": [],
  "input_contract": [
    "explicit_run_root_read_only"
  ],
  "output": {
    "html": "state/<timestamp>/state_report.html",
    "svg": "state/<timestamp>/state_dag.svg",
    "nodes": "state/<timestamp>/state_nodes.csv",
    "summary": "state/<timestamp>/state_summary.json"
  },
  "implementation": {
    "purpose": "read_only_execution_dag_visualization",
    "state_access": "read_only",
    "invocation": "explicit_human_request_only",
    "dag_registration": "forbidden"
  }
}
