{"schema_version":"2.0.0","capability_id":"O004","skill_name":"cs-conductor-on-demand-analysis","display_name":"CONDUCTOR On-demand Analysis","version":"0.1.9","stage":"orchestration","family":"on_demand","description":"Roundと通常DAGに干渉せず、人間依頼をREQ recordとしてRun内で解析・報告する。","cost":{"class":"low","human_approval_required":false,"hpc_profile":"cpu64"},"applicability":{"status":"stable","platforms":["linux-64","win-64"]},"dependencies":[],"input_contract":["explicit_run_root","human_request","explicit_sources"],"output":{"directory":"on_demand/REQ######","markdown":"result.md","html":"result.html","manifest":"artifact_manifest.json"},"implementation":{"state_access":"read_only","round_participation":"forbidden","dag_registration":"forbidden","record_namespace":"REQ","network_install":"forbidden"}}
